TYPE,name,id,standard,description,thumbnail,frontend,Twitter,Discord,Release date?,Standard repo,Questions,Command
,Cronic Critters,e3izy-jiaaa-aaaah-qacbq-cai,EXT,"Cronics is a Play-to-earn NFT game being developed by ToniqLabs for the Internet Computer. Cronics  incorporates breeding mechanics, wearable NFTs and a p2e minigame ecosystem and more.",https://e3izy-jiaaa-aaaah-qacbq-cai.raw.ic0.app/?tokenid=hancg-5ykor-uwiaa-aaaaa-b4aaq-maqca-aabuk-a,https://cronic.toniqlabs.com/,https://twitter.com/CronicsP2E,https://discord.com/invite/toniqlabs,,https://github.com/Toniq-Labs/extendable-token,Is the nft standard the same as the token?,"dfx canister --network=ic --no-wallet call nft add ""(record {principal_id= principal \""e3izy-jiaaa-aaaah-qacbq-cai\""; name= \""Cronic Critters\""; standard= \""EXT\""; description= \""Cronics is a Play-to-earn NFT game being developed by ToniqLabs for the Internet Computer. Cronics  incorporates breeding mechanics, wearable NFTs and a p2e minigame ecosystem and more.\""; icon= \""https://e3izy-jiaaa-aaaah-qacbq-cai.raw.ic0.app/?tokenid=hancg-5ykor-uwiaa-aaaaa-b4aaq-maqca-aabuk-a\""})"""
,Starverse,nbg4r-saaaa-aaaah-qap7a-cai,EXT,"Starverse is an NFT collection of rare and unique Stars, a collaboration between DSCVR and ToniqLabs. The Starverse symbolizes the unlimited potential of the Internet Computer with it’s infinite size and unstoppable nature.",https://nbg4r-saaaa-aaaah-qap7a-cai.raw.ic0.app/?tokenid=wdyem-pikor-uwiaa-aaaaa-b4ad7-yaqca-aacsh-a,https://starverse.toniqlabs.com/,https://twitter.com/toniqlabs,https://discord.com/invite/toniqlabs,,https://github.com/Toniq-Labs/extendable-token,,"dfx canister --network=ic --no-wallet call nft add ""(record {principal_id= principal \""nbg4r-saaaa-aaaah-qap7a-cai\""; name= \""Starverse\""; standard= \""EXT\""; description= \""Starverse is an NFT collection of rare and unique Stars, a collaboration between DSCVR and ToniqLabs. The Starverse symbolizes the unlimited potential of the Internet Computer with it’s infinite size and unstoppable nature.\""; icon= \""https://nbg4r-saaaa-aaaah-qap7a-cai.raw.ic0.app/?tokenid=wdyem-pikor-uwiaa-aaaaa-b4ad7-yaqca-aacsh-a\""})"""
,Wrapped ICPunks,bxdf4-baaaa-aaaah-qaruq-cai,EXT,"ICPunks wrapped under the EXT standard. 10,000 randomly generated, unique collectible clowns with proof of ownership stored on the Internet Computer blockchain. Created as a reference to a meme comparing the Internet Computer token (ICP) with the Insane Clown Posse.",https://qcg3w-tyaaa-aaaah-qakea-cai.raw.ic0.app/Token/1,https://icpunks.com/,https://twitter.com/icpunks,https://discord.com/invite/Gghf7WZRCQ,,https://github.com/Toniq-Labs/extendable-token,,"dfx canister --network=ic --no-wallet call nft add ""(record {principal_id= principal \""bxdf4-baaaa-aaaah-qaruq-cai\""; name= \""Wrapped ICPunks\""; standard= \""EXT\""; description= \""ICPunks wrapped under the EXT standard. 10,000 randomly generated, unique collectible clowns with proof of ownership stored on the Internet Computer blockchain. Created as a reference to a meme comparing the Internet Computer token (ICP) with the Insane Clown Posse.\""; icon= \""https://qcg3w-tyaaa-aaaah-qakea-cai.raw.ic0.app/Token/1\""})"""
,ICP News,uzhxd-ziaaa-aaaah-qanaq-cai,EXT,An NFT collection set designed by the @icp_news artist with an Internet Computer theme.,https://uzhxd-ziaaa-aaaah-qanaq-cai.raw.ic0.app/?tokenid=3qdzl-jikor-uwiaa-aaaaa-b4adi-eaqca-aaaad-q,,https://twitter.com/icp_news,,,https://github.com/Toniq-Labs/extendable-token,,"dfx canister --network=ic --no-wallet call nft add ""(record {principal_id= principal \""uzhxd-ziaaa-aaaah-qanaq-cai\""; name= \""ICP News\""; standard= \""EXT\""; description= \""An NFT collection set designed by the @icp_news artist with an Internet Computer theme.\""; icon= \""https://uzhxd-ziaaa-aaaah-qanaq-cai.raw.ic0.app/?tokenid=3qdzl-jikor-uwiaa-aaaaa-b4adi-eaqca-aaaad-q\""})"""
,Cronic Wearables,tde7l-3qaaa-aaaah-qansa-cai,EXT,"Wearable NFTs, usable with the Cronics NFT collection. A Play-to-earn NFT game being developed by ToniqLabs for the Internet Computer. Cronics  incorporates breeding mechanics, wearable NFTs, a p2e minigame ecosystem, and more.",https://tde7l-3qaaa-aaaah-qansa-cai.raw.ic0.app/?tokenid=gvmdu-vikor-uwiaa-aaaaa-b4adm-qaqca-aakby-a,https://cronic.toniqlabs.com/,https://twitter.com/CronicsP2E,https://discord.com/invite/toniqlabs,,https://github.com/Toniq-Labs/extendable-token,,"dfx canister --network=ic --no-wallet call nft add ""(record {principal_id= principal \""tde7l-3qaaa-aaaah-qansa-cai\""; name= \""Cronic Wearables\""; standard= \""EXT\""; description= \""Wearable NFTs, usable with the Cronics NFT collection. A Play-to-earn NFT game being developed by ToniqLabs for the Internet Computer. Cronics  incorporates breeding mechanics, wearable NFTs, a p2e minigame ecosystem, and more.\""; icon= \""https://tde7l-3qaaa-aaaah-qansa-cai.raw.ic0.app/?tokenid=gvmdu-vikor-uwiaa-aaaaa-b4adm-qaqca-aakby-a\""})"""
,ICMojis,gevsk-tqaaa-aaaah-qaoca-cai,EXT,"A collection inspired in old school forum emotes, designed by the artist @Visions_GFX, also part of the interactive strategy game ICMoji Origins.",https://gevsk-tqaaa-aaaah-qaoca-cai.raw.ic0.app/?tokenid=vqwej-jikor-uwiaa-aaaaa-b4adq-qaqca-aaaac-q,https://graci-aaaaa-aaaah-aaqjq-cai.raw.ic0.app/,https://twitter.com/Visions_GFX,https://discord.com/invite/toniqlabs,,https://github.com/Toniq-Labs/extendable-token,,"dfx canister --network=ic --no-wallet call nft add ""(record {principal_id= principal \""gevsk-tqaaa-aaaah-qaoca-cai\""; name= \""ICMojis\""; standard= \""EXT\""; description= \""A collection inspired in old school forum emotes, designed by the artist @Visions_GFX, also part of the interactive strategy game ICMoji Origins.\""; icon= \""https://gevsk-tqaaa-aaaah-qaoca-cai.raw.ic0.app/?tokenid=vqwej-jikor-uwiaa-aaaaa-b4adq-qaqca-aaaac-q\""})"""
,ICPuzzle,owuqd-dyaaa-aaaah-qapxq-cai,EXT,"The ICPuzzle NFT is an artistic NFT that is meant to invoke thought around individuality, community, and the beauty of the human condition. Each puzzle piece represents human individuality within humanity, a self-contained piece of a larger cohesive whole.",https://owuqd-dyaaa-aaaah-qapxq-cai.raw.ic0.app/?tokenid=2e7o5-wykor-uwiaa-aaaaa-b4ad5-4aqca-aaagc-q,,https://twitter.com/MyArtBar,https://discord.com/invite/toniqlabs,,https://github.com/Toniq-Labs/extendable-token,,"dfx canister --network=ic --no-wallet call nft add ""(record {principal_id= principal \""owuqd-dyaaa-aaaah-qapxq-cai\""; name= \""ICPuzzle\""; standard= \""EXT\""; description= \""The ICPuzzle NFT is an artistic NFT that is meant to invoke thought around individuality, community, and the beauty of the human condition. Each puzzle piece represents human individuality within humanity, a self-contained piece of a larger cohesive whole.\""; icon= \""https://owuqd-dyaaa-aaaah-qapxq-cai.raw.ic0.app/?tokenid=2e7o5-wykor-uwiaa-aaaaa-b4ad5-4aqca-aaagc-q\""})"""
,Wrapped IC Drip,3db6u-aiaaa-aaaah-qbjbq-cai,EXT,IC Drip are randomly generated NFTs with meta-commerce shopping carts for outfits and personas stored on chain on the Internet Computer.,https://d3ttm-qaaaa-aaaai-qam4a-cai.raw.ic0.app/?tokenId=1,https://dvr6e-lqaaa-aaaai-qam5a-cai.raw.ic0.app/,https://twitter.com/ICdripland,https://discord.gg/RVX6CqnApW,,https://github.com/Toniq-Labs/extendable-token,,"dfx canister --network=ic --no-wallet call nft add ""(record {principal_id= principal \""3db6u-aiaaa-aaaah-qbjbq-cai\""; name= \""Wrapped IC Drip\""; standard= \""EXT\""; description= \""IC Drip are randomly generated NFTs with meta-commerce shopping carts for outfits and personas stored on chain on the Internet Computer.\""; icon= \""https://d3ttm-qaaaa-aaaai-qam4a-cai.raw.ic0.app/?tokenId=1\""})"""
,IC Drip,d3ttm-qaaaa-aaaai-qam4a-cai,ICPunks,IC Drip are randomly generated NFTs with meta-commerce shopping carts for outfits and personas stored on chain on the Internet Computer.,https://d3ttm-qaaaa-aaaai-qam4a-cai.raw.ic0.app/?tokenId=11,https://dvr6e-lqaaa-aaaai-qam5a-cai.raw.ic0.app/,https://twitter.com/ICdripland,https://discord.gg/RVX6CqnApW,,https://github.com/Toniq-Labs/extendable-tokenn,,"dfx canister --network=ic --no-wallet call nft add ""(record {principal_id= principal \""d3ttm-qaaaa-aaaai-qam4a-cai\""; name= \""IC Drip\""; standard= \""ICPunks\""; description= \""IC Drip are randomly generated NFTs with meta-commerce shopping carts for outfits and personas stored on chain on the Internet Computer.\""; icon= \""https://d3ttm-qaaaa-aaaai-qam4a-cai.raw.ic0.app/?tokenId=11\""})"""
,Wing,73xld-saaaa-aaaah-qbjya-cai,EXT,An NFT photographic series created by the photographer @olisav ,https://73xld-saaaa-aaaah-qbjya-cai.raw.ic0.app/?tokenid=tpx6i-sykor-uwiaa-aaaaa-b4ako-aaqca-aaaaz-a,,https://twitter.com/olisav,https://discord.com/invite/toniqlabs,,https://github.com/Toniq-Labs/extendable-token,,"dfx canister --network=ic --no-wallet call nft add ""(record {principal_id= principal \""73xld-saaaa-aaaah-qbjya-cai\""; name= \""Wing\""; standard= \""EXT\""; description= \""An NFT photographic series created by the photographer @olisav \""; icon= \""https://73xld-saaaa-aaaah-qbjya-cai.raw.ic0.app/?tokenid=tpx6i-sykor-uwiaa-aaaaa-b4ako-aaqca-aaaaz-a\""})"""
,ICPunks,qcg3w-tyaaa-aaaah-qakea-cai,ICPunks,"10,000 randomly generated, unique collectible clowns with proof of ownership stored on the Internet Computer blockchain. Created as a reference to a meme comparing the Internet Computer token (ICP) with the Insane Clown Posse - an American hip hop duo founded in 1989.",https://qcg3w-tyaaa-aaaah-qakea-cai.raw.ic0.app/Token/1,https://icpunks.com/,https://twitter.com/icpunks,https://discord.com/invite/Gghf7WZRCQ,,https://github.com/stopak/ICPunks/blob/dev/service/icpunks_rust.did,,"dfx canister --network=ic --no-wallet call nft add ""(record {principal_id= principal \""qcg3w-tyaaa-aaaah-qakea-cai\""; name= \""ICPunks\""; standard= \""ICPunks\""; description= \""10,000 randomly generated, unique collectible clowns with proof of ownership stored on the Internet Computer blockchain. Created as a reference to a meme comparing the Internet Computer token (ICP) with the Insane Clown Posse - an American hip hop duo founded in 1989.\""; icon= \""https://qcg3w-tyaaa-aaaah-qakea-cai.raw.ic0.app/Token/1\""})"""
,ICPBunny,xkbqi-2qaaa-aaaah-qbpqq-cai,ICPunks,A bunny-themed NFT collection that uses utility tokens to enable yieldable and breedable NFTs on the Internet Computer.,https://storageapi.fleek.co/fleek-team-bucket/ICPBunny.png,https://hae47-fyaaa-aaaaf-qaeiq-cai.raw.ic0.app/,https://twitter.com/ICPBunny,https://discord.gg/FdUcCS3w6S,,https://github.com/stopak/ICPunks/blob/dev/service/icpunks_rust.did,,"dfx canister --network=ic --no-wallet call nft add ""(record {principal_id= principal \""xkbqi-2qaaa-aaaah-qbpqq-cai\""; name= \""ICPBunny\""; standard= \""ICPunks\""; description= \""A bunny-themed NFT collection that uses utility tokens to enable yieldable and breedable NFTs on the Internet Computer.\""; icon= \""https://storageapi.fleek.co/fleek-team-bucket/ICPBunny.png\""})"""
,ICPBunny (Testnet),6olkk-7iaaa-aaaah-qboaa-cai,ICPunks,Testnet. A bunny-themed NFT collection that uses utility tokens to enable yieldable and breedable NFTs on the Internet Computer.,https://storageapi.fleek.co/fleek-team-bucket/ICPBunny.png,https://hae47-fyaaa-aaaaf-qaeiq-cai.raw.ic0.app/,https://twitter.com/ICPBunny,https://discord.gg/FdUcCS3w6S,,https://github.com/stopak/ICPunks/blob/dev/service/icpunks_rust.did,,"dfx canister --network=ic --no-wallet call nft add ""(record {principal_id= principal \""6olkk-7iaaa-aaaah-qboaa-cai\""; name= \""ICPBunny (Testnet)\""; standard= \""ICPunks\""; description= \""Testnet. A bunny-themed NFT collection that uses utility tokens to enable yieldable and breedable NFTs on the Internet Computer.\""; icon= \""https://storageapi.fleek.co/fleek-team-bucket/ICPBunny.png\""})"""
,ICelebrity,kss7i-hqaaa-aaaah-qbvmq-cai,EXT,"An NFT collection of 100 unique minted celebrities (Hollywood, Football Players, Singers and more).",https://kss7i-hqaaa-aaaah-qbvmq-cai.raw.ic0.app/?tokenid=bubur-lykor-uwiaa-aaaaa-b4anl-eaqca-aaaae-a,,https://twitter.com/ICelebrityNFT,https://discord.com/invite/AZFq4QMYBx,,,,"dfx canister --network=ic --no-wallet call nft add ""(record {principal_id= principal \""kss7i-hqaaa-aaaah-qbvmq-cai\""; name= \""ICelebrity\""; standard= \""EXT\""; description= \""An NFT collection of 100 unique minted celebrities (Hollywood, Football Players, Singers and more).\""; icon= \""https://kss7i-hqaaa-aaaah-qbvmq-cai.raw.ic0.app/?tokenid=bubur-lykor-uwiaa-aaaaa-b4anl-eaqca-aaaae-a\""})"""
,Candy Library,hdxhu-qqaaa-aaaai-aasnq-cai,DepartureLabs,"Candy Library NFTs - distribution licenses for a motoko software library, fund software!",https://storageapi.fleek.co/fleek-team-bucket/dab/candy-lib.png,https://hwqwz-ryaaa-aaaai-aasoa-cai.raw.ic0.app/,,,,,,"dfx canister --network=ic --no-wallet call nft add ""(record {principal_id= principal \""hdxhu-qqaaa-aaaai-aasnq-cai\""; name= \""Candy Library\""; standard= \""DepartureLabs\""; description= \""Candy Library NFTs - distribution licenses for a motoko software library, fund software!\""; icon= \""https://storageapi.fleek.co/fleek-team-bucket/dab/candy-lib.png\""})"""
,Cake,wxi2q-oiaaa-aaaaj-qab2q-cai,EXT,Slices of cake celebrating the birthdays of IC builders. Proceeds fund open source development.,https://storageapi.fleek.co/fleek-team-bucket/logos/cake-logo.png,https://cake.aviate-labs.com/,https://twitter.com/quint_av8,,,,,"dfx canister --network=ic --no-wallet call nft add ""(record {principal_id= principal \""wxi2q-oiaaa-aaaaj-qab2q-cai\""; name= \""Cake\""; standard= \""EXT\""; description= \""Slices of cake celebrating the birthdays of IC builders. Proceeds fund open source development.\""; icon= \""https://storageapi.fleek.co/fleek-team-bucket/logos/cake-logo.png\""})"""
,ICPuppies,njgly-uaaaa-aaaah-qb6pa-cai,EXT,"10,000 unique randomly generated 8-bit puppy NFTs on the Internet Computer.",https://storageapi.fleek.co/fleek-team-bucket/logos/ICPuppies.png,,https://twitter.com/ICPuppies,https://discord.com/invite/A3rmDSjBaJ,,,,"dfx canister --network=ic --no-wallet call nft add ""(record {principal_id= principal \""njgly-uaaaa-aaaah-qb6pa-cai\""; name= \""ICPuppies\""; standard= \""EXT\""; description= \""10,000 unique randomly generated 8-bit puppy NFTs on the Internet Computer.\""; icon= \""https://storageapi.fleek.co/fleek-team-bucket/logos/ICPuppies.png\""})"""
,Internet Astronauts,sr4qi-vaaaa-aaaah-qcaaq-cai,EXT,"Internet Astronauts is a collection of 10,000 unique digital astronaut NFT collectibles only found on the Internet Computer.",https://storageapi.fleek.co/fleek-team-bucket/logos/internetastro.jpeg,https://interastrosc.com/,https://twitter.com/interastrosc,https://discord.gg/MwUGfQTkWK,,,,"dfx canister --network=ic --no-wallet call nft add ""(record {principal_id= principal \""sr4qi-vaaaa-aaaah-qcaaq-cai\""; name= \""Internet Astronauts\""; standard= \""EXT\""; description= \""Internet Astronauts is a collection of 10,000 unique digital astronaut NFT collectibles only found on the Internet Computer.\""; icon= \""https://storageapi.fleek.co/fleek-team-bucket/logos/internetastro.jpeg\""})"""
,ICMojis Items,cihkf-qyaaa-aaaah-qb7jq-cai,EXT,Collection of items that will be integrated into the ICmojis Origins game in the future.,https://storageapi.fleek.co/fleek-team-bucket/logos/items.png,https://graci-aaaaa-aaaah-aaqjq-cai.raw.ic0.app/,https://twitter.com/Visions_GFX,https://discord.com/invite/toniqlabs,,,,"dfx canister --network=ic --no-wallet call nft add ""(record {principal_id= principal \""cihkf-qyaaa-aaaah-qb7jq-cai\""; name= \""ICMojis Items\""; standard= \""EXT\""; description= \""Collection of items that will be integrated into the ICmojis Origins game in the future.\""; icon= \""https://storageapi.fleek.co/fleek-team-bucket/logos/items.png\""})"""
,Wrapped ICPBunny,q6hjz-kyaaa-aaaah-qcama-cai,EXT,"Wrapped version of ICPBunny, a bunny-themed NFT collection that uses utility tokens to enable yieldable and breedable NFTs on the Internet Computer.",https://storageapi.fleek.co/fleek-team-bucket/ICPBunny.png,https://hae47-fyaaa-aaaaf-qaeiq-cai.raw.ic0.app/,https://twitter.com/ICPBunny,https://discord.gg/FdUcCS3w6S,,,,"dfx canister --network=ic --no-wallet call nft add ""(record {principal_id= principal \""q6hjz-kyaaa-aaaah-qcama-cai\""; name= \""Wrapped ICPBunny\""; standard= \""EXT\""; description= \""Wrapped version of ICPBunny, a bunny-themed NFT collection that uses utility tokens to enable yieldable and breedable NFTs on the Internet Computer.\""; icon= \""https://storageapi.fleek.co/fleek-team-bucket/ICPBunny.png\""})"""
,ICTuts,ahl3d-xqaaa-aaaaj-qacca-cai,EXT,"10,000 randomly generated TuTs, a pharaoh-themed NFT collections on the Internet Computer.",https://storageapi.fleek.co/fleek-team-bucket/logos/tuts.jpg,https://ictuts.com/,https://twitter.com/ICTuTs,https://discord.com/invite/sMByysB3Tf,,,,"dfx canister --network=ic --no-wallet call nft add ""(record {principal_id= principal \""ahl3d-xqaaa-aaaaj-qacca-cai\""; name= \""ICTuts\""; standard= \""EXT\""; description= \""10,000 randomly generated TuTs, a pharaoh-themed NFT collections on the Internet Computer.\""; icon= \""https://storageapi.fleek.co/fleek-team-bucket/logos/tuts.jpg\""})"""
,The Moonwalkers,er7d4-6iaaa-aaaaj-qac2q-cai,EXT,"These Animal Astronauts unlock massive influence in the growing ecosystem of the IC Gallery. The Moonwalker collection combines 3 essential forces of the Metaverse into 1 NFT: a 2D Profile Picture, a 3D Video, and a 3D Model.",https://storageapi.fleek.co/fleek-team-bucket/logos/3D_moonwalkers_icon__800x800_.png,https://zfjzz-4aaaa-aaaah-aasbq-cai.raw.ic0.app/,https://twitter.com/ic_gallery,discord.gg/6VWZNzskPA,,,,"dfx canister --network=ic --no-wallet call nft add ""(record {principal_id= principal \""er7d4-6iaaa-aaaaj-qac2q-cai\""; name= \""The Moonwalkers\""; standard= \""EXT\""; description= \""These Animal Astronauts unlock massive influence in the growing ecosystem of the IC Gallery. The Moonwalker collection combines 3 essential forces of the Metaverse into 1 NFT: a 2D Profile Picture, a 3D Video, and a 3D Model.\""; icon= \""https://storageapi.fleek.co/fleek-team-bucket/logos/3D_moonwalkers_icon__800x800_.png\""})"""
,Principia Mathematica,lhq4n-3yaaa-aaaai-qaniq-cai,DepartureLabs,"An Ode to Mathematics, a silent tribute to the greatest minds of all time.",https://storageapi.fleek.co/fleek-team-bucket/principia.png,https://7xw5z-uqaaa-aaaad-qaqcq-cai.raw.ic0.app/,https://twitter.com/NFTStudioPoland,https://discord.com/invite/65P4NzzSQx,,,,"dfx canister --network=ic --no-wallet call nft add ""(record {principal_id= principal \""lhq4n-3yaaa-aaaai-qaniq-cai\""; name= \""Principia Mathematica\""; standard= \""DepartureLabs\""; description= \""An Ode to Mathematics, a silent tribute to the greatest minds of all time.\""; icon= \""https://storageapi.fleek.co/fleek-team-bucket/principia.png\""})"""
,ICGhost,nfvlz-jaaaa-aaaah-qcciq-cai,EXT,"The 3D ICGhost NFT scenes will be the largest NFT release since the Dfinity Foundation launched the ICP network in May of 2021. On October 29, 2021, sixty thousand NFTs will be released in ten thousand spooky but adorable scenes. Each 3D ICGhost NFT scene contains six separate 3D NFTs that include a landscape, a ghost with hat & glasses, and two other scene items.",https://storageapi.fleek.co/fleek-team-bucket/logos/IC3D.png,https://ic3dnft.art/,https://twitter.com/IC3DNFT,https://discord.com/invite/toniqlabs,,,,"dfx canister --network=ic --no-wallet call nft add ""(record {principal_id= principal \""nfvlz-jaaaa-aaaah-qcciq-cai\""; name= \""ICGhost\""; standard= \""EXT\""; description= \""The 3D ICGhost NFT scenes will be the largest NFT release since the Dfinity Foundation launched the ICP network in May of 2021. On October 29, 2021, sixty thousand NFTs will be released in ten thousand spooky but adorable scenes. Each 3D ICGhost NFT scene contains six separate 3D NFTs that include a landscape, a ghost with hat & glasses, and two other scene items.\""; icon= \""https://storageapi.fleek.co/fleek-team-bucket/logos/IC3D.png\""})"""
,Motoko Day Drop,oeee4-qaaaa-aaaak-qaaeq-cai,EXT,Motoko-themed NFT Collection on the Internet Computer.,https://oeee4-qaaaa-aaaak-qaaeq-cai.raw.ic0.app/?cc=0&type=thumbnail&tokenid=w5txv-gakor-uwiaa-aaaaa-cuaab-eaqca-aadhc-a,https://dfinity.org/,,,,,,"dfx canister --network=ic --no-wallet call nft add ""(record {principal_id= principal \""oeee4-qaaaa-aaaak-qaaeq-cai\""; name= \""Motoko Day Drop\""; standard= \""EXT\""; description= \""Motoko-themed NFT Collection on the Internet Computer.\""; icon= \""https://oeee4-qaaaa-aaaak-qaaeq-cai.raw.ic0.app/?cc=0&type=thumbnail&tokenid=w5txv-gakor-uwiaa-aaaaa-cuaab-eaqca-aadhc-a\""})"""
,Infinite Chimps,pnpu4-3aaaa-aaaah-qcceq-cai,EXT,Every Infinite Chimp in this NFT collection is a portrait of a rescued chimp that now lives peacefully at the sanctuary.,https://pnpu4-3aaaa-aaaah-qcceq-cai.raw.ic0.app/?cc=0&type=thumbnail&tokenid=sqpc5-5akor-uwiaa-aaaaa-b4aqr-eaqca-aaaav-a,,,,,,,"dfx canister --network=ic --no-wallet call nft add ""(record {principal_id= principal \""pnpu4-3aaaa-aaaah-qcceq-cai\""; name= \""Infinite Chimps\""; standard= \""EXT\""; description= \""Every Infinite Chimp in this NFT collection is a portrait of a rescued chimp that now lives peacefully at the sanctuary.\""; icon= \""https://pnpu4-3aaaa-aaaah-qcceq-cai.raw.ic0.app/?cc=0&type=thumbnail&tokenid=sqpc5-5akor-uwiaa-aaaaa-b4aqr-eaqca-aaaav-a\""})"""
,Haunted Hamsters,bid2t-gyaaa-aaaah-qcdea-cai,EXT,NFT set of 6666 Haunted Hamsters.,https://storageapi.fleek.co/fleek-team-bucket/logos/HH.jpg,,,,,,,"dfx canister --network=ic --no-wallet call nft add ""(record {principal_id= principal \""bid2t-gyaaa-aaaah-qcdea-cai\""; name= \""Haunted Hamsters\""; standard= \""EXT\""; description= \""NFT set of 6666 Haunted Hamsters.\""; icon= \""https://storageapi.fleek.co/fleek-team-bucket/logos/HH.jpg\""})"""
,IC Pumpkins,btggw-4aaaa-aaaah-qcdgq-cai,EXT,"ICPumpkin is 2222 unique pumpkins! The collection consists of 20 really different cool characters, each with their own mood and costume.",https://btggw-4aaaa-aaaah-qcdgq-cai.raw.ic0.app/?cc=0&type=thumbnail&tokenid=dbmzw-tykor-uwiaa-aaaaa-b4aqz-uaqca-aaaah-a,,,,,,,"dfx canister --network=ic --no-wallet call nft add ""(record {principal_id= principal \""btggw-4aaaa-aaaah-qcdgq-cai\""; name= \""IC Pumpkins\""; standard= \""EXT\""; description= \""ICPumpkin is 2222 unique pumpkins! The collection consists of 20 really different cool characters, each with their own mood and costume.\""; icon= \""https://btggw-4aaaa-aaaah-qcdgq-cai.raw.ic0.app/?cc=0&type=thumbnail&tokenid=dbmzw-tykor-uwiaa-aaaaa-b4aqz-uaqca-aaaah-a\""})"""
,Tyler Monsein & Dakota Light-Smith,dv6u3-vqaaa-aaaah-qcdlq-cai,EXT,Tyler and Dakota are a writer / designer team interested in semiotics and altered states. This is a video series in which common phrases become hypnotic mantras.,https://dv6u3-vqaaa-aaaah-qcdlq-cai.raw.ic0.app/?cc=0&type=thumbnail&tokenid=hrhxl-sakor-uwiaa-aaaaa-b4aq2-4aqca-aaaaa-a,,,,,,,"dfx canister --network=ic --no-wallet call nft add ""(record {principal_id= principal \""dv6u3-vqaaa-aaaah-qcdlq-cai\""; name= \""Tyler Monsein & Dakota Light-Smith\""; standard= \""EXT\""; description= \""Tyler and Dakota are a writer / designer team interested in semiotics and altered states. This is a video series in which common phrases become hypnotic mantras.\""; icon= \""https://dv6u3-vqaaa-aaaah-qcdlq-cai.raw.ic0.app/?cc=0&type=thumbnail&tokenid=hrhxl-sakor-uwiaa-aaaaa-b4aq2-4aqca-aaaaa-a\""})"""
,Neil White,crt3j-mqaaa-aaaah-qcdnq-cai,EXT,Neil White is a Miami-based contemporary artist. His work focuses on ironic portraits of historical icons and social commentary in the form of robots.,https://crt3j-mqaaa-aaaah-qcdnq-cai.raw.ic0.app/?cc=0&type=thumbnail&tokenid=rtuc6-kqkor-uwiaa-aaaaa-b4aq3-maqca-aaaaa-q,,,,,,,"dfx canister --network=ic --no-wallet call nft add ""(record {principal_id= principal \""crt3j-mqaaa-aaaah-qcdnq-cai\""; name= \""Neil White\""; standard= \""EXT\""; description= \""Neil White is a Miami-based contemporary artist. His work focuses on ironic portraits of historical icons and social commentary in the form of robots.\""; icon= \""https://crt3j-mqaaa-aaaah-qcdnq-cai.raw.ic0.app/?cc=0&type=thumbnail&tokenid=rtuc6-kqkor-uwiaa-aaaaa-b4aq3-maqca-aaaaa-q\""})"""
,André Wee,cnxby-3qaaa-aaaah-qcdpq-cai,EXT,"André Wee, a newcomer to the NFT Art scene, is an experimental illustrator that jumps between both the virtual and physical world when he creates his craft.",https://cnxby-3qaaa-aaaah-qcdpq-cai.raw.ic0.app/?cc=0&type=thumbnail&tokenid=b6qdx-lykor-uwiaa-aaaaa-b4aq3-4aqca-aaaaa-a,,,,,,,"dfx canister --network=ic --no-wallet call nft add ""(record {principal_id= principal \""cnxby-3qaaa-aaaah-qcdpq-cai\""; name= \""André Wee\""; standard= \""EXT\""; description= \""André Wee, a newcomer to the NFT Art scene, is an experimental illustrator that jumps between both the virtual and physical world when he creates his craft.\""; icon= \""https://cnxby-3qaaa-aaaah-qcdpq-cai.raw.ic0.app/?cc=0&type=thumbnail&tokenid=b6qdx-lykor-uwiaa-aaaaa-b4aq3-4aqca-aaaaa-a\""})"""
